{
  "schema_version": 1,
  "id": "WI-043-agent-tool-execution",
  "state": "queued",
  "type": "develop-feature",
  "assigned_role": "maker",
  "attempts": 0,
  "max_attempts": 3,
  "touches_protected_path": true,
  "allowed_edit_set": [
    "scripts/agent/tool-registry.mjs",
    "scripts/agent/run-cycle.mjs",
    "schemas/config.schema.json",
    "tests/tool-registry.test.mjs"
  ],
  "gates": [
    "node --test tests/tool-registry.test.mjs",
    "node scripts/check-style.mjs .",
    "npm run verify"
  ],
  "queued_at": "2026-07-04"
}
