{
  "schema_version": 1,
  "id": "WI-042-researcher-agent-loop-integration",
  "state": "queued",
  "type": "develop-feature",
  "assigned_role": "researcher",
  "attempts": 0,
  "max_attempts": 3,
  "touches_protected_path": true,
  "allowed_edit_set": [
    "scripts/agent/run-cycle.mjs",
    "prompts/roles/researcher.txt",
    "tests/researcher-role.test.mjs"
  ],
  "gates": [
    "node --test tests/researcher-role.test.mjs",
    "node scripts/check-style.mjs .",
    "npm run verify"
  ],
  "queued_at": "2026-07-04"
}
