{
  "schema_version": 1,
  "id": "WI-055-risk-surface-guard",
  "state": "claimed",
  "type": "develop-feature",
  "attempts": 0,
  "max_attempts": 3,
  "touches_protected_path": true,
  "allowed_edit_set": [
    "scripts/risk-surface-guard.mjs",
    "scripts/lib/risk-surface-rules.mjs",
    "scripts/lib/risk-surface-allowlist.mjs",
    "scripts/check-risk-surface-allowlist.mjs",
    "scripts/lib/message-catalog/gate/risk-surface-guard.mjs",
    "scripts/lib/message-catalog/gate/check-risk-surface-allowlist.mjs",
    "scripts/lib/message-catalog/index.mjs",
    "scripts/check-self-application.mjs",
    "scripts/check-gate-dag.mjs",
    "schemas/gate-graph.json",
    "schemas/risk-surface-allowlist.schema.json",
    ".modonome/risk-surface-allowlist.json",
    "tests/risk-surface-guard.test.mjs",
    "tests/check-risk-surface-allowlist.test.mjs",
    "tests/self-application.test.mjs",
    "fixtures/risk-surface/should-flag/*",
    "fixtures/risk-surface/should-allow/*",
    "fixtures/risk-surface/allowlist/*",
    "docs/risk-surface-guard.md",
    "docs/adr/ADR-047-risk-surface-guard.md",
    "docs/README.md",
    "action.yml",
    ".github/workflows/ci.yml",
    "package.json",
    "README.md",
    "SECURITY.md",
    "CHANGELOG.md",
    "RELEASE-EVIDENCE.md",
    ".modonome/snapshot/*",
    ".modonome/policy-attestation.json",
    ".modonome/work-items/WI-055-risk-surface-guard.json"
  ],
  "gates": [
    "node scripts/check-style.mjs .",
    "node --test tests/risk-surface-guard.test.mjs",
    "node --test tests/check-risk-surface-allowlist.test.mjs",
    "node scripts/check-gate-dag.mjs",
    "node scripts/check-self-application.mjs",
    "node scripts/check-risk-surface-allowlist.mjs",
    "npm run verify"
  ],
  "queued_at": "2026-07-27",
  "maker_id": "techseek4vr",
  "lease_owner": "techseek4vr"
}
