{
  "schema_version": 1,
  "id": "WI-037-deterministic-priority-scoring",
  "state": "done",
  "attempts": 0,
  "max_attempts": 3,
  "touches_protected_path": true,
  "allowed_edit_set": [
    "scripts/score-proposals.mjs",
    "scripts/dry-run-sweep.mjs",
    "tests/score-proposals.test.mjs"
  ],
  "gates": [
    "node --test tests/score-proposals.test.mjs",
    "node scripts/check-style.mjs .",
    "npm run verify"
  ],
  "queued_at": "2026-07-01",
  "type": "develop-feature"
}
