{
  "schema_version": 1,
  "id": "WI-016-add-arming-checklist-to-quickstart",
  "state": "done",
  "attempts": 0,
  "max_attempts": 3,
  "touches_protected_path": false,
  "allowed_edit_set": [
    "QUICKSTART.md",
    "README.md"
  ],
  "gates": [
    "node scripts/check-style.mjs ."
  ],
  "type": "update-docs"
}
