{
  "schema_version": 1,
  "id": "wave-1-governance-and-samples",
  "state": "merge_ready",
  "touches_protected_path": true,
  "escalation_reason": "Approved plan to make autonomy real. Wave 1 bundles WS-0 (lifecycle and empty-queue run-blocker fixes), WS-H (runner and model config layer), WS-A (runnable sample apps with planted debt), and WS-E (negative-control corpus). The owner approved the plan; protected paths scripts/, .github/, schemas/, templates/, and prompts/ are in scope.",
  "maker_id": "maker:wave-1:claude-opus-4-8",
  "maker_model": "claude-opus-4-8",
  "checker_id": "checker:wave-1:claude-sonnet-4-6",
  "checker_model": "claude-sonnet-4-6",
  "allowed_edit_set": [
    "scripts/",
    ".github/",
    "schemas/",
    "templates/",
    "prompts/",
    "examples/",
    "fixtures/",
    "tests/",
    "docs/",
    ".gitignore",
    ".modonome/work-items/"
  ],
  "gates": ["verify", "ratchet"]
}
