{
  "schema_version": 1,
  "id": "WI-021-root-cleanup",
  "state": "done",
  "attempts": 1,
  "max_attempts": 3,
  "touches_protected_path": true,
  "allowed_edit_set": [
    ".github/CODEOWNERS",
    "CODEOWNERS",
    "scripts/check-self-application.mjs",
    "scripts/guard-ratchet.mjs",
    "scripts/assert-governed-change.mjs",
    "tests/ratchet.test.mjs",
    "agentproof/fixtures/ratchet-orphaned-vitest-deletion.patch",
    "vitest-path-traversal-security.test.ts",
    "vitest-path-validation-utils.ts",
    "vitest-ui-client-fixed.ts",
    "vitest-websocket-security.test.ts",
    "vitest-websocket-setup-fixed.ts",
    ".modonome/work-items/WI-021-root-cleanup.json",
    ".modonome/STATUS.md"
  ],
  "gates": [
    "node scripts/check-style.mjs .",
    "node scripts/check-self-application.mjs",
    "node scripts/check-repo-hygiene.mjs",
    "node --test tests/*.test.mjs"
  ],
  "type": "chore"
}
