{
  "schema_version": 1,
  "id": "WI-004-fix-agentproof-runner-consistency",
  "state": "done",
  "attempts": 0,
  "max_attempts": 2,
  "touches_protected_path": true,
  "allowed_edit_set": [
    "agentproof/runner.mjs",
    "agentproof/README.md"
  ],
  "gates": [
    "node agentproof/runner.mjs",
    "node --test tests/*.test.mjs"
  ],
  "type": "fix-issue"
}
